nombre,ubicacion,descripcion
La Cripta Olvidada,Ciudad de las Sombras,Una antigua cripta llena de tumbas centenarias y estatuas misteriosas.
La Cueva de los Murmullos,Bosque Susurrante,Una cueva con paredes que susurran secretos olvidados y sombras inquietantes.
El Laberinto Espectral,Reinos Fantasmales,Un intrincado laberinto lleno de ilusiones y portales dimensionales.
La Fortaleza Abandonada,Desierto Desolado,Una fortaleza en ruinas habitada por criaturas desérticas y trampas mortales.
La Gruta de los Elementos,Montañas Elemental,Una gruta mágica con salas dedicadas a cada uno de los cuatro elementos.
La Torre de los Enigmas,Ciudad de los Sabios,Una torre llena de acertijos y pruebas intelectuales para desafiar a los aventureros.
El Pantano de las Almas Perdidas,Marisma de los Lamentos,Un pantano oscuro donde las almas perdidas vagan eternamente y criaturas acechan en la oscuridad.
La Prisión de Hielo,Tierras Heladas,Una prisión con celdas heladas donde criaturas gélidas custodian valiosos tesoros.
La Sima Infernal,Abismo Ardiente,Una sima profunda que lleva a las entrañas ardientes de la tierra, habitada por demonios y lava letal.
El Templo de las Maravillas,Ciudad Celestial,Un templo lleno de maravillas celestiales y guardianes divinos.
El Bosque Encantado,Bosque Encantado,Un bosque encantado donde la magia da vida a los árboles y las criaturas místicas protegen sus secretos.
La Cámara de las Sombras,Subterráneo Siniestro,Una cámara llena de sombras que cobran vida y desafían a quienes osan entrar.
La Ciudad Subterránea,Ciudad de los Túneles,Una ciudad construida en las profundidades de la tierra, habitada por razas subterráneas y amenazas ocultas.
La Biblioteca Arcana,Ciudad de los Conocimientos,Una biblioteca mágica llena de tomos antiguos y conocimientos arcanos, pero también custodiada por guardianes literales.
El Valle de las Quimeras,Valle de Ensueño,Un valle lleno de criaturas míticas y paisajes oníricos que desafían la realidad.
El Refugio del Dracolich,Montaña de las Sombras,Un refugio oscuro donde un dracolich antiguo descansa, rodeado de no-muertos y secretos olvidados.
La Caverna Cristalina,Cavernas Relucientes,Una caverna resplandeciente llena de cristales mágicos y criaturas lumínicas.
La Pradera de las Pesadillas,Pradera Sombría,Una pradera donde las pesadillas se manifiestan, desafiando a los aventureros con horrores surrealistas.
La Ciudad de los Espejismos,Desierto Ilusorio,Una ciudad que aparece y desaparece en medio del desierto, llevando a los viajeros a la locura.
El Abismo Astral,Planos Astrales,Un abismo interdimensional donde las leyes de la realidad se retuercen, habitado por seres cósmicos y abominaciones astrales.